{
  "$schema": "https://json-schema.org/draft/2020-12/schema",
  "$id": "https://underleague.dev/schemas/items.schema.json",
  "title": "Underleague item",
  "description": "data/items/<id>.json: un objeto de equipamiento por fichero (RF-075..078, ADR 0036). UN OBJETO SUBE ATRIBUTOS Y NADA MAS: no existe 'effects' (eso es lo que hace un perk) y no existe 'description' (se genera desde el dato, RT-035, Sim.Run.Systems.Items.ItemDescriptions). La rareza fija cuantos atributos sube y el arquetipo la magnitud o el riesgo; el numero exacto de atributos y su magnitud los comprueba el cargador contra data/equipment/equipment.json, porque JSON Schema no puede expresar 'tantas entradas como diga otro fichero'.",
  "type": "object",
  "properties": {
    "_doc": { "type": "string" },
    "id": {
      "type": "string",
      "pattern": "^[a-z][a-z0-9_]*$",
      "description": "Debe coincidir con el nombre del fichero."
    },
    "name": { "$ref": "#/$defs/localizedName" },
    "rarity": {
      "description": "Cuantos atributos sube (ADR 0036: comun 1, poco comun 2, raro 3). Ausente solo en archetype=restricted, que no tiene rareza.",
      "enum": ["common", "uncommon", "rare"]
    },
    "archetype": {
      "description": "RF-077: tres arquetipos obligatorios en el catalogo (cursed, fragile, restricted), ademas de normal.",
      "enum": ["normal", "cursed", "fragile", "restricted"]
    },
    "frequency": {
      "description": "ADR 0051 (el 'commonness' de Angband): cuanto sale este objeto en el pool comparado con uno normal, en porcentaje. 100 = lo normal. Multiplica al peso por valor de la ADR 0038 y a la curva de profundidad.",
      "type": "integer",
      "minimum": 10,
      "maximum": 500
    },
    "minAct": {
      "description": "ADR 0051 (profundidad nativa): acto a partir del cual el objeto empieza a aparecer en el pool de recompensas y de mercado. Por debajo de el solo sale FUERA DE PROFUNDIDAD, con el peso pequeno de data/build/arcs.json. Ausente = 1.",
      "type": "integer",
      "minimum": 1,
      "maximum": 3
    },
    "attributeBonus": {
      "description": "Modificadores de atributo del objeto. Las entradas positivas son lo que sube (tantas como su rareza permita); la unica entrada negativa, si la hay, es la contrapartida del maldito.",
      "type": "object",
      "properties": {
        "strength": { "$ref": "#/$defs/modifier" },
        "speed": { "$ref": "#/$defs/modifier" },
        "technique": { "$ref": "#/$defs/modifier" },
        "stamina": { "$ref": "#/$defs/modifier" },
        "leash": { "$ref": "#/$defs/modifier" }
      },
      "minProperties": 1,
      "additionalProperties": false
    },
    "breakChancePercent": {
      "description": "Solo en archetype=fragile: probabilidad de romperse AL TERMINAR el partido (RF-077, ADR 0036). Se muestra antes de equipar (RF-012d).",
      "type": "integer",
      "minimum": 1,
      "maximum": 99
    },
    "race": {
      "description": "Solo en archetype=restricted: raza de la que el objeto es exclusivo (ADR 0036). Solo aparece en runs de esa raza y solo funciona sobre un portador de esa raza.",
      "enum": ["Human", "Orc", "Elf", "Dwarf", "Undead", "DarkElf", "Demon", "Vampire", "Lizard"]
    },
    "relic": {
      "description": "Marca el objeto como reliquia (ADR 0161 S2): no aparece en el mercado ni en las recompensas, solo llega al almacen cuando muere un jugador propio, segun lo que destaco en su RunCareer.",
      "enum": ["scorer", "butcher", "wall", "generic"]
    }
  },
  "required": ["id", "name", "archetype", "attributeBonus"],
  "additionalProperties": false,
  "allOf": [
    {
      "if": { "properties": { "archetype": { "const": "fragile" } }, "required": ["archetype"] },
      "then": { "required": ["breakChancePercent"] },
      "else": { "not": { "required": ["breakChancePercent"] } }
    },
    {
      "if": { "properties": { "archetype": { "const": "restricted" } }, "required": ["archetype"] },
      "then": { "required": ["race"], "not": { "required": ["rarity"] } },
      "else": { "required": ["rarity"], "not": { "required": ["race"] } }
    }
  ],
  "$defs": {
    "localizedName": {
      "type": "object",
      "properties": {
        "es": { "type": "string", "minLength": 1 },
        "en": { "type": "string", "minLength": 1 }
      },
      "required": ["es", "en"],
      "additionalProperties": false
    },
    "modifier": { "type": "integer", "minimum": -60, "maximum": 60 }
  }
}
