{
  "_doc": "Maldito raro: una bestia fisica que no sabe jugar. En un central o un pivote destructor es una ganga; en el organizador del equipo tira la build a la basura. ADR 0107: el castigo sube para que el valor MEDIDO del maldito sea NEGATIVO. Antes {'strength': 20, 'speed': 20, 'stamina': 20, 'technique': -20} valia +132; ahora {'strength': 20, 'speed': 20, 'stamina': 20, 'technique': -60} vale -18. La maldicion era una ganga en los cuatro malditos -incluso brutes_pauldron, neto CERO en puntos, valia +45 porque la fuerza (111) cuesta casi el doble que la velocidad (66)-, asi que colocarlo mal no costaba nada y el arquetipo era sabor, no decision (RF-077).",
  "id": "berserker_totem",
  "name": {
    "es": "Tótem del berserker",
    "en": "Berserker Totem"
  },
  "rarity": "rare",
  "archetype": "cursed",
  "minAct": 2,
  "attributeBonus": {
    "strength": 20,
    "speed": 20,
    "stamina": 20,
    "technique": -60
  }
}
